{"$schema":"https://json-schema.org/draft/2020-12/schema","title":"S1ChunkStrategy","description":"Existing S1 packing/preparation and its exact qualified model contract.","type":"object","properties":{"chunker_version":{"description":"Existing S1 chunker version.","type":"string","maxLength":4096},"collection_id":{"description":"Declared `collection_id`; no inferred default.","type":"string","maxLength":128,"minLength":1,"pattern":"^[A-Za-z0-9][A-Za-z0-9_.-]*$"},"hard_max_tokens":{"description":"Maximum complete prepared input, including context and special tokens.","type":"integer","format":"uint64","minimum":1},"id":{"description":"Declared `id`; no inferred default.","type":"string","maxLength":128,"minLength":1,"pattern":"^[A-Za-z0-9][A-Za-z0-9_.-]*$"},"model":{"description":"Existing S1 model card pin.","$ref":"#/$defs/PolicyReference"},"model_limits":{"description":"Checked against the card, never trusted on its own.","$ref":"#/$defs/Limits"},"owner_ref":{"description":"Declared `owner_ref`; no inferred default.","$ref":"#/$defs/PolicyReference"},"preparation_profile":{"description":"Exact corresponding preparation profile.","type":"string","maxLength":4096},"qualification":{"description":"External strategy qualification.","$ref":"#/$defs/PolicyReference"},"schema":{"description":"Declared `schema`; no inferred default.","$ref":"#/$defs/ChunkSchema"},"scope_tags":{"description":"Declared `scope_tags`; no inferred default.","type":"array","items":{"type":"string"},"maxItems":10000},"target_tokens":{"description":"Supported target packing budget.","type":"integer","format":"uint64","minimum":1},"tokenizer_qualification":{"description":"Exact externally qualified tokenizer evidence.","$ref":"#/$defs/PolicyReference"},"version":{"description":"Declared `version`; no inferred default.","type":"integer","format":"uint64","minimum":1},"visibility":{"description":"Declared `visibility`; no inferred default.","$ref":"#/$defs/Visibility"}},"additionalProperties":false,"required":["schema","id","version","collection_id","visibility","scope_tags","owner_ref","chunker_version","preparation_profile","target_tokens","hard_max_tokens","model","tokenizer_qualification","model_limits","qualification"],"$defs":{"ChunkSchema":{"description":"Closed chunk artifact version.","oneOf":[{"description":"Version one.","type":"string","const":"maestro-s1-chunk-strategy/1"}]},"Limits":{"description":"What a model can take and give, as the bake-off measured it.","type":"object","properties":{"context_tokens":{"description":"The most tokens the model reads at once.","type":"integer","format":"uint32","minimum":1},"output_tokens":{"description":"The most tokens one reply may hold; none for a model that generates\nnothing.","type":["integer","null"],"format":"uint32","minimum":1}},"additionalProperties":false,"required":["context_tokens"]},"PolicyReference":{"description":"A source-policy resource identity, not a path or an access grant.","type":"object","properties":{"digest":{"description":"Exact immutable SHA-256 resource digest.","type":"string","pattern":"^[0-9a-f]{64}$"},"id":{"description":"Logical resource identifier, validated by the source-policy resolver.","type":"string","maxLength":128,"minLength":1,"pattern":"^[A-Za-z0-9][A-Za-z0-9_.-]*$"}},"additionalProperties":false,"required":["id","digest"]},"Visibility":{"description":"The closed set of Visibility values.","oneOf":[{"description":"`public`.","type":"string","const":"public"},{"description":"`private`.","type":"string","const":"private"}]}}}
